{"$defs":{"Classification":{"enum":["CORRECT","BUGGY","NONDETERMINISTIC","INCOMPLETE","INFRA_ERROR_EXPECTED"],"type":"string"},"Verdict":{"enum":["PASS","FAIL","INCONCLUSIVE","ERROR"],"type":"string"}},"$schema":"https://json-schema.org/draft/2020-12/schema","additionalProperties":false,"properties":{"allowed_verdicts":{"items":{"$ref":"#/$defs/Verdict"},"type":"array"},"benchmark_case_id":{"type":"string"},"category":{"type":"string"},"config_identity":{"type":"string"},"execution_budget":{"format":"uint64","minimum":0,"type":"integer"},"expected_classification":{"$ref":"#/$defs/Classification"},"fixture_identity":{"type":"string"},"notes":{"type":"string"},"product":{"type":"string"},"schema_version":{"const":"1","type":"string"},"tags":{"items":{"type":"string"},"type":"array"},"timeout_ms":{"format":"uint64","minimum":0,"type":"integer"}},"required":["schema_version","benchmark_case_id","product","category","expected_classification","fixture_identity","config_identity","allowed_verdicts","tags","timeout_ms","execution_budget","notes"],"title":"BenchmarkCase","type":"object"}